Formato,Nome Formato,Programas que usam formato,Autor
7z,7z compressed archive file,7Zip WinRAR WinZip,7-Zip and Igor Pavlov
ace,WinAce Compressed File,E-merge WinAce (Windows) ESTsoft ALZip (Windows) IZArc (Windows) MacUnace (Mac) PeaZip (Windows) The Unarchiver (Mac),WinAce
apk,Android Package File,Google Android SDK 7-Zip WinRar Android phones,Android
bz2,BZzip2 compressed archive file,Corel WinZip Smith Micro StuffIt Deluxe 2010 WinRAR 5 PeaZipExternal Link 7-Zip Incredible Bee Archiver The Unarchiver,Julian Seward
crx,Chrome Extension,"7-Zip (Windows) Google Chrome (Windows, Mac & Linux)",Google
dd,DiskDoubler Archive,DDExpand (Mac) SuperDoubler (Mac) Symantec Norton DiskDoubler (Mac) The Unarchiver (Mac),Symantec
deb,Debian Software Package,7-Zip (Windows) Adept (Linux) Cydia (iOS) Debian package management system (Linux) IZArc (Windows) Synaptic Package Manager (Linux),
gz,Gnu Zipped Archive File,Smith Micro StuffIt Deluxe 2010 Corel WinZip 18.5 7-Zip Xarchive WinRAR 5,The GNU Project
gzip,Gnu Zipped File,Smith Micro Stufflt Deluxe 2010 (Windows) Corel WinZip 18.5 (Windows) 7-Zip (Windows) Smith Micro Stufflt Deluxe 16 (Mac) Apple archive Utility (Mac) Gzip (Linux) Xarchive (Linux),"Jean-loup Gailly, Mark Adler"
jar,Java Archive File,Oracle Java Runtime Environment Corel WinZip Mac Edition 3 Apple Jar Launcher Web Browsers,"Netscape, Sun Microsystems, Oracle Corporation"
mht,Multipurpose Internet Mail Extension HTML,Mozilla Firefox Google Chrome Microsoft Internet Explorer Safari,Microsoft
mpkg,Meta Package File,Apple Installer (Mac),
pup,PlayStation 3 Update File,PS3 PUP Extractor (Windows),Sony
r01,WinRAR Split Archive Part 1,7-Zip (Windows) Corel WinZip (Windows) Incredible Bee Archiver (Mac) RARLAB RAR (Mac & Linux) WinRAR (Windows),RARLAB
rar,WinRAR Compressed Archive,7Zip StuffIt WinRAR WinZip,Eugene Roshal
rpm,Red Hat Package Manager File,Alien (Linux) Incredible Bee Archiver (Mac) Red Hat Package Manager (Linux) The Unarchiver (Mac),Red Hat
sit,StuffIt Archive,Smith Micro StuffIt Deluxe (Windows & Mac) The Unarchiver (Mac) Incredible Bee Archiver (Mac) ExtractNow (Windows),Smith Micro
sitx,StuffIt X Archive,Incredible Bee Archiver (Mac) Smith Micro StuffIt Deluxe (Windows & Mac) The Unarchiver (Mac),Smith Micro
snb,S Note File,Samsung S Note snbopen,Samsung
tar,Consolidated Unix File Archive,Apple Archive Utility GNU Tar Corel WinZip 18.5 7-Zip,The GNU Project
tar.gz,Compressed Tarball File,7-Zip (Windows) Acubix PicoZip (Windows) Apple Archive Utility (Mac) Ark (Linux) Corel WinZip (Windows) gzip (Linux) PeaZip (Windows) Smith Micro StuffIt Deluxe (Windows & Mac) The Unarchiver (Mac) WinInizio ZipGenius (Windows) WinRAR 5 (Windows) Xarchive (Linux) ZDevs ZArchiver (Android),The GNU Project
tbz,Bzip Compressed Tar Archive,7-zip (Linux) Apple Archive Utility (Mac) Smith Micro StuffIt Deluxe (Windows & Mac) Corel WinZip (Windows) Incredible Bee Archiver (Mac) tar (Linux),
tgz,Gzipped Tar File,"Smith Micro Stuffit Deluxe 2010 (Windows, Mac) WinRAR 5 (Windows) Corel WinZip 18.5 (Windows) 7-Zip (Windows) Zipeg (Windows, Mac) Incredible Bee Archiver (Mac) Tar (Linux) Gunzip (Linux) Pkgtool (Linux)",
zip,ZIP compression,StuffIt WinRAR Winzip,PKWARE
zipx,Extended Zip File,"B1 Free Archiver (Windows, Mac, Linux & Android) ConeXware PowerArchiver (Windows) Corel WinZip (Windows & Mac) PeaZip (Windows) RARLAB RAR (Android) The Unarchiver (Mac)",Corel
3ga,3GPP Audio File,Windows Media Player QuickTime Player VLC Media Player,3rd Generation Partnership Project (3GPP)
aa,Audible Audio Book File,Audible AudibleManager (Windows) Apple iTunes (Windows & Mac) Nero (Windows) Audials Tunebite (Windows) SoundTaxi Media Suite (Windows) TuneCab (Windows),Audible
aac,MPEG-2 Advanced Audio Coding File,Windows Media Player iTunes KMPlayer RealPlayer VideoLAN VLC Media Player,"Fraunhofer IIS, AT&T Bell Laboratories, Dolby, and Sony Corporation"
aax,Audible Enhanced Audiobook File,Apple iTunes (Windows & Mac),Audible
adpcm,Adaptive Differential Pulse-Code Modulation File,,
aif,Audio Interchange File Format,Windows Media Player Apple Quicktime Winamp VLC Media Player,Apple Inc
aifc,Compressed Audio Interchange File,Apple iTunes Apple QuickTime Player Microsoft Windows Media Adobe Audition CC Vgmstream Cog,Apple
aiff,Audio Interchage File Format,Apple QuickTime VLC media Player Winamp Windows Media Player,Apple Inc
amr,Adaptive Multi-Rate Codec File,Audacity Android Open Source software AMR Player QuickTime Real Player VLS Media Player Apple iPhone,3rd Generation Partnership Project (3GPP)
ape,Monkey's Audio Lossless Audio File,Adobe Audition CC 2015 AIMP Cog Monkey's Audio MPlayer NCH WavePad Nullsoft Winamp with Monkey's Audio Plugin,Matthew T. Ashland
asx,Microsoft Advanced Stream Redirector File,Microsoft Windows Media Player Nullsoft Winamp Roxio Creator NXT Pro 3 Ventis Media MediaMonkey 4 GRETECH GOM Player VideoLAN VLC media player,Microsoft
au,Audio File,Nullsoft Winamp Apple QuickTime Player Microsoft Windows Media Player RealNetworks RealPlayer Cloud Adobe Audition CC,Sun Microsystems
aup,Audacity Project File,Audacity,Audacity
awb,AMR-WB Audio File,AMR Player FairStars Audio Converter Nokia Multimedia Converter,Nokia
caf,Apple Core Audio Format,Soundtrack Pro Logic Studio QuickTime,Apple Inc
cda,CD Audio Track Shortcut,Nullsoft Winap VideoLAN VLC media player Apple iTunes Microsoft windows Media Player,
cdo,Crescendo Music Notation File,NCH Crescendo Music Notation Editor (Windows),NCH Software
flac,Free Lossless Audio Codec File,Real Player VLC Media Player Windows Media Player,Xiph.Org Foundation
gsm,Global System for Mobile Audio File,VideoLAN VLC media player SoX NCH Switch,
iff,EA Interchange File Format,"ACD Systems ACDSee (Windows) ACD Systems Canvas (Windows) Adobe Audition (Windows & Mac) Apple QuickTime Player (Windows & Mac) Cloanto Amiga Forever (Windows, Mac & Linux) Corel PaintShop Pro X8 (Windows) IFFPencil (Windows) IFFSnooper (Mac) IrfanView (Windows) ShedWorx Smart Converter (Mac) XnViewMP (Windows & Linux)",Electronic Arts
kar,Karaoke files,Mireth Technology Music Man Nullsoft Winamp PG music Band-in-a-Box Recisio KaraFun vanBasco's Karaoke Player,Tune 1000 Corp
koz,Audiokoz Music File,This file can not be opened on a computer.,Audiokoz
m3u8,UTF-8 M3U Playlist File,Apple iTunes CocoModX Foobar2000 Nullsoft Winamp RealNetworks RealPlayer Cloud Roxio Creator NXT Pro 3 Songbird VideoLAN VLC media player XMMS,
m4a,MPEG-4 Audio Layer,Apple QuickTime Player Apple iTunes Microsoft Windows Media Player VideoLan VLC Media Player,Apple
m4b,MPEG-4 Audio Book File,"Apple iTunes (Windows & Mac) File Viewer Plus (Windows) Nullsoft Winamp (Windows) Microsoft Windows Media Player (Windows) Roxio Creator NXT Pro (Windows) Ventis Media MediaMonkey (Windows) VideoLAN VLC media player (Windows, Mac & Linux)",Apple
m4p,iTunes Music Store Audio File,KMPlayer iTunes Spotify VideoLAN VLC Madia Player QuickTime,Apple Inc.
m4r,iPhone Ringtone File,Apple QuickTime Player Apple iTunes,Apple Inc
mid,Musical Instrument Digital Interface MIDI-sequention Sound,Audio Evolution Sonar Master Tacks Pro GarageBand,Various
midi,MIDI files,Apple QuickTime Player Microsoft Windows Media Player Nullsoft Winamp Sonar GarageBand Audio Evolution Master Tacks Pro,Various
mmf,Synthetic Music Mobile Application File,"Yamaha MidRadio Player (Windows, Mac) Yamaha Mobile Contents Player (Windows)",Yamaha
mp2,MPEG Layer II Compressed Audio File,"Apple iTunes (Windows, Mac) Microsoft Windows Media Player (Windows) RealNetworks RealPlayer Cloud (Windows, Mac, Linux) VideoLAN VLC Media Player (Windows, Mac, Linux) PeonySoft MP2 Converter (Windows) Adobe Audition (Windows, Mac)",Moving Picture Experts Group
mp3,MPEG Layer 3 Audio,RealOne WinAmp Windows Media Player iTunes Real Player,Fraunhofer Institute
mpa,MPEG-2 Audio File,"Apple iTunes (Windows, Mac) Apple QuickTime Player (Windows, Mac) Microsoft Windows Media Player (Windows) RealNetwork RealPlayer Cloud (Windows, Mac & Linux) VideoLAN VLC media player (Windows, Mac, Linux & iOS)",
mpc,Musepack Compressed Audio File,Aqualung Audacious DeliPlayer jetAudio JRiver Media Center MPlayer Nullsoft Winamp (plug-in needed) VideoLAN VLC media player,Musepack
mpga,MPEG-1 Layer 3 Audio File,Apple iTunes Microsoft Windows Media Player Real Networks Linux-Any Audio Player,
nfa,Netflix Audio File,Netflix (iOS & Android),Netflix
oga,Ogg Vorbis Audio File,"Apple QuickTime Player (Windows, Mac & Linux) File Viewer Plus (Windows) JRiver Media Center (Windows) Media Player Classic (Windows) MPlayer (Mac) Nullsoft Winamp (Windows) Totem (Linux) VideoLAN VLC media player (Windows, Mac & Linux) Zinf (Windows)",Xiph.Org
ogg,Ogg Vorbis Audio File,Apple QuickTime Player Real Player Windows Media Player,Xiph.Org Foundation
oma,Sony OpenMG audio,"Sony SonicStage (Windows) VideoLAN VLC media player (Windows, Mac, Linux)",Sony
opus,Opus Audio File,AIMP VideoLAN VLC Media Player OPUS tools,Xiph.org
qcp,Qualcomm PureVoice Audio File,QUALCOMM PureVoice Player-Recorder QUALCOMM PureVoice Converter QUALCOMM PureVoice SDK VideoLAN VLC Media Player,Qualcomm
ra,Real Audio File,"RealNetworks RealPlayer Cloud (Windows, Mac, Linux, iOS, Android) VideoLAN VLC Media Player (Windows, Mac, Linux) DVDVideoSoft Free Audio Converter (Windows) Web Browser With the RealPlayer Plugin (Windows, Mac, Linux)",RealNetworks
ram,Real Media Audio Metadata File,RealNetworks RealPlayer Cloud VideoLAN VLC Media Player,Real Networks
rta,TrueRTA Project File,True Audio TrueRTA Adobe RoboHelp 11,True Audio
wav,WAVE Audio,CyberLink PowerDirector Microsoft Windows Media Player Roxio Creator 2009 VideoLAN VLC Media Player,Microsoft & IBM
wma,Windows Media (Metafile),MPlayer Realplayer VLC Media Player Windows Media Player Windows Movie Maker Zune software Open Source,Microsoft
xspf,XML Shareable Playlist Format,Roxio Creator NXT Pro (Windows) VideoLAN VLC media player (Windows) Clementine (Windows VideoLAN VLC media player (Mac) Clementine (Mac) Amarok (Linux) Audacious (Linux) VideoLAN VLC media player (Linux) Clementine (Linux),N/A – open source
3dm,Rhino 3D Model,Autodesk Fusion 360 (Windows) IMSI TurboCAD Deluxe v8 (Mac) McNeel Rhino (Windows & Mac),Robert McNeel & Associates
3ds,3D Studio Scene,"Adobe Photoshop (Windows & Mac) Autodesk 3ds Max (Windows) CADSoftTools ABViewer (Windows) Cheetah3D (Mac) GLC_Player (Windows, Mac & Linux) IMSI TurboCAD Deluxe (Windows & Mac) MAXON Cinema 4D (Windows & Mac) MeshLab (Windows & Mac) pmG messiahStudio (Windows & Mac) Trimble SketchUp (Windows & Mac)",Autodesk
dwg,AutoCAD Drawing Database File,Adobe Illustrator AutoCAD Autodesk DWG TrueView CorelCAD,Autodesk
dxf,Drawing Exchange Format File,Adobe Illustratror AutoCAD CorelCAD Open Office PaintShop Pro,Autodesk
max,3ds Max Scene File,Autodesk 3ds Max,Autodesk
obj,Wavefront 3D Object File,"Adobe Photoshop CC (Windows & Mac) Autodesk AutoCAD (Windows) Autodesk Maya (Windows, Mac & Linux) Blender (Windows, Mac & Linux) Cheetah3D (Mac) Dassault Systemes SolidWorks (Windows) DAZ 3D DAZ Studio (Windows & Mac) GLC_Player (Linux) IMSI TurboCAD Deluxe (Mac) IMSI TurboCAD Pro (Windows) MeshLab (Windows, Mac & Linux) MAXON Cinema 4D (Windows & Mac) NewTek Lightwave (Windows & Mac) Siemens Solid Edge (Windows) Smith Micro Poser (Windows & Mac)",Wavefront Technologies
stp,STEP 3D CAD File,"Autodesk Fusion (Windows & Mac, iOS, Android & Windows Phone) CADSoftTools ABViewer (Windows) Dassault Systemes CATIA (Windows & Linux) eMachineShop Free Online STEP File Viewer (Web) FreeCAD (Windows, Mac & Linux) ideaMK STP Viewer (Windows) IMSI TurboCAD Pro (Windows & Mac) LKSoft IDA-STEP (Windows & Linux) Okino Computer Graphics PolyTrans (Windows) ShareCAD.org (Web) Wikifactory (Web)",
aae,Sidecar Image Edit File,Apple Photos (Mac) Apple Text Edit (Mac) Microsoft Notepad (Windows),Apple
adt,ACT! Document Template,Swiftpage Act! (Windows),Sage Software
bok,TestGen Testbank File,Pearson Education TestGen (Windows & Mac),Pearson Education
cel,Affymetrix Probe Results File,"Affymetrix Tiling Analysis Software (Windows) dChip (Windows) multi-aff-py (Windows, Mac & Linux) RMAExpress (Windows) The MathWorks MATLAB (Windows) VSN GenStat (Windows)",Affymetrix
clp,Windows Clipboard File,Corel PaintShop Pro (Windows) IrfanView (Windows) Microsoft ClipBook Viewer (Windows),Microsoft
cma,Coach Activity File,CMA Coach (Windows),CMA Foundation
dif,Data Interchange Format,"Apache OpenOffice (Windows, Mac & Linux) Corel WordPerfect (Windows) Gnumeric (Windows & Linux) IBM Collaboration Solutions (Windows) Microsoft Access (Windows) Microsoft Excel (Windows & Mac) Microsoft Notepad (Windows) Planamesa NeoOffice (Mac) SAS Institute SAS (Windows & Mac) Other text editors",Microsoft
efx,eFax Document,"j2 Global Communications eFax (Windows, Mac & Linux)",j2 Global Communications
fcpevent,Final Cut Pro Event File,Apple Final Cut Pro X (Mac),Apple
flo,RFFlow Flowchart File,RFF Electronics RFFlow (Windows),RFF Electronics
gbr,Gerber File,"Altium Designer (Windows) Artwork Conversion GBR2DXF (Windows) gEDA (Mac & Linux) Gerbv (Windows, Mac & Linux) GraphiCode GC-Prevue (Windows) PentaLogix ViewMate (Windows) Pentalogix ViewMaster (Windows) PTC Creo View Express (Windows)",Ucamco
gcw,Microsoft Mathematics Worksheet,Microsoft Mathematics (Windows),Microsoft
ged,GEDCOM Genealogy Data File,"Ages! (Windows) Ancestral Author (Windows) Behold (Windows) GeneWeb (Windows, Mac & Linux) Gramps (Windows, Mac & Linnux) Leister Prodcustions Reunion (Mac) LifeLines (Windows & Linux) RootsMagic (Windows) Taurus FamilyTree (Windows & Mac) Thoughtful Creations Genbox Family History (Windows)",The LDS Church
gms,Gesture and Motion Signal File,"LibGMS (Windows, Mac & Linux)",GMS
i5z,IUCLID 5 Import/Export File,IUCLID5 (Windows),IUCLID
ip,IconPackage Theme File,7-Zip (Windows) Stardock IconPackage (Windows),Stardock
itl,iTunes Library File,Apple iTunes,Apple
keychain,Mac OS X Keychain File,Apple Keychain Access,Apple
mtw,Minitab Worksheet File,Minitab (Windows),Minitab
nfi,Netflix Information File,Netflix (iOS & Android),Netflix
nfs,Netflix Subtitle File,Netflix (iOs & Android),Netflix
one,OneNote Document,Microsoft OneNote 2016 (Windows) Outline (Mac),Microsoft
ova,Open Virtual Appliance,"Oracle VM Virtualbox (Windows, Mac & Linux) VMware Fusion (Mac) VMware OVF Tool (Windows, Mac & Linux) VMware vCenter Converter (Windows) VMware Workstation (Windows & Linux)",VMware
ovf,Open Virtualization File,"Oracle VM Virtualbox (Windows, Mac & Linux) VMware Fusion (Mac) VMware OVF Tool (Windows, Mac & Linux) VMware Workstation (Windows & Linux)",VMware
qb2011,QuickBooks 2011 File,Intuit QuickBooks (Mac),Intuit
quickendata,Quicken Essentials for Mac Data File,Intuit Quicken (Mac),Intuit
rte,Revit Project Template,Autodesk AutoCAD Architecture (Windows) Autodesk MEP (Windows) Autodesk Revit Structure (Windows),Autodesk
rvt,Revit Project File,Autodesk AutoCAD Architecture (Windows) Autodesk MEP (Windows) Autodesk Revit Structure (Windows),Autodesk
sdf,Standard Data File,Pervasive PSQL dBase Rosenvick AspireGold,
tax,TurboTax Tax Return,Intuit TurboTax (Windows & Mac),Intuit
tax2012,TurboTax 2012 Tax Return,Intuit TurboTax Deluxe (Windows & Mac) TurboTax Online,Intuit
tax2014,TurboTax 2014 Tax Return,Intuit TurboTax Deluxe (Windows & Mac),Intuit
tax2016,TurboTax 2016 Tax Return,Intuit TurboTax Deluxe (Windows & Mac),Intuit
vcf,vCard File,Microsoft Windows Contacts Palm Desktop QUALCOMM Eudora Microsoft Outlook 2013 vCard Organizer Nokia PC Suite,Internet Mail Consortium
vcs,vCalendar Event File,Apple Calendar (Mac) Calligra Suite (Linux) Evolution (Linux) Microsoft Outlook 2016 (Windows & Mac),
xmind,XMind Workbook File,"Xmind (Windows, Mac & Linux) Seavus iMindQ (Windows, Mac & iOS)",XMind
accdb,Access 2007 Database File,Microsoft Access (Windows) Microsoft Visual Studio (Windows) MDB Viewer (Windows & Mac),Microsoft
bup,DVD Info Backup File,CD Indexer Brother Embroidery System File PC-Bibliothek Update File,
crypt,WhatsApp Encrypted Dastabase File,"WhatsApp Messenger (Android, iOS & Windows Phone) WhatsApp Xtract (Android)",WhatsApp
db,Database file,Microsoft Windows Microsoft Access 2013 Corel paradox Libre Office SQ lite,Microsoft Corporation
dbf,Database File,dBase Microsoft Access 2016 Microsoft Excel 2016 Microsoft Visual FoxPro Corel Quattro Pro X7 Apache OpenOffice HiBase Group DBF Viewer 2000 Astersoft DBF Manager DBF Viewer Plus DBFView Swiftpage Act! Alpha Software Alpha Anywhere Planamesa NeoOffice (Mac) GTK DBF Editor (Mac & Linux) multisoft FlagShip (Linux),dBASE
mdb,Microsoft Access Database,Freewind MDB Converter (Windows) Kexi (Linux) mdb-expot (Linux) MDBopener (Web) MDB Viewer (Mac) MDB Viewer Plus (Windows) Microsoft Access 2016 (Windows) Microsoft Visual Studio 2013 (Windows) SAS Institute SAS (Windows & Linux) Wolfram Research Mathematica (Windows & Mac),Microsoft
pdb,Program Database,ICE Book Reader Palm Reader Microsoft Visual Studio Pegasus Quicken,Various
sql,Structured Query Language Data File,"Altova DatabaseSpy (Windows) Apple TextEdit (Mac) Bare Bones BBEdit (Mac) gVim (Windows) MacroMates TextMate (Mac) MalcolmHardie Solutions SQLEditor (Mac) Microsoft Notepad (Windows) MySQL (Windows, Mac & Linux) Richardson RazorSQL (Windows, Mac & Linux) Other text editors",
apa,RSView Development Project Archive,Rockwell Automation RSView Studio (Windows) RSView ME (Windows),Rockwell Automation
asc,ActionScript Communication File,Adobe Flash Professional (Windows & Mac),Adobe Systems
asm,Assembly Language Source Code File,File Viewer Plus (Windows) GNU Emacs (Linux) gVim (Windows) MacroMates TextMate (Mac) MacVim (Mac) Microsoft Notepad (Windows) Pico (Linux) Vim (Linux) Any Text Editor,
b,BASIC Source Code File,FreeBasic (Windows) Microsoft Visual Studio (Windows) PowerBASIC (Windows) PureBasic (Windows) Any text editor (Windows & Mac),
bas,BASIC Source Code File,"BBC BASIC for Windows (Windows) Blitz Research BlitzMax (Windows, Mac & Linux) FreeBASIC (Windows) Microsoft Visual Studio (Windows) PowerBASIC (Windows) PureBasic (Windows) SoftMaker Office (Windows) True BASIC (Windows)",
bet,BETA Source File,"BETA Compiler (Windows, Mac & Linux) Any Text Editor",
bluej,BlueJ Package File,"BlueJ (Windows, Mac & Linux)",University of Kent
c,C/C++ Source Code File,"Apple Xcode (Mac) BloodshedSoftware Dev-C++ (Windows) Borland C++Builder (Windows) Code::Blocks (Windows, Mac & Linux) Eclipse IDE for C Developers (Windows, Mac & Linux) Embarcadero C++Builder (Windows) ES-Computing EditPlus (Windows) Freescale CodeWarrior Development Tools (Mac) GNU Emacs (Linux) gVim (Windows) MacroMates TextMate (Mac) Microsoft Visual Studio 2013 (Windows) Vim (Linux) ZinjaI (Windows, Mac & Linux)",
cbl,COBOL Source Code File,"Alchemy Solutions NetCOBOL (Windows) File Viewer Plus (Windows) GnuCOBOL (Windows, Mac & Linux) IBM COBOL (Windows) TinyCOBOL (Linux)",
ccc,Dev-C++ Code Completion Cache,BloodshedSoftware Dev-C++ (Windows) Orwell Dev-C++ (Windows),
cd,Visual Studio Class Diagram,Microsoft Visual Studio (Windows),Microsoft
class,Java Class File,"Apple Jar Launcher (Mac) dirtyJOE (Windows) DJ Java Decompiler (Windows) Eclipse IDE for Java Developers (Windows, Mac & Linux) JD-GUI (Windows, Mac & Linux) Oracle Java Runtime Environment (Windows, Mac & Linux)",Oracle
cod,Compiled Source Code,BlackBerry JDE (Windows) dBase (Windows) Microsoft Visual Studio (Microsoft),
cpp,C++ Source Code File,"Apple Xcode (Mac) BloodshedSoftware Dev-C++ (Windows) Code::Blocks (Windows, Mac & Linux) Eclipse IDE for C Developers (Windows, Mac & Linux) Embarcadero Technologies C++ Builder (Windows) ES-Computing EditPlus (Windows) Freescale CodeWarrior Cevelopment Tool (Mac) GNU Compiler Collection (Mac & Linux) MacroMate TextMate (Mac) Microsoft Visual Studio 2013 (Windows)",
cs,Visual C# Source Code File,"Adobe Dreamweaver (Windows & Mac) ES-Computing EditPlus (Windows) IC Code SharpDevelop (Windows) Microsoft Visual Studio (Windows) MonoDevelop (Windows, Mac & Linux) Notepad++ (Windows)",Microsoft
d,D Source Code File,"Code::Blocks (Windows, MAC & Linux) Digital Mars D compiler (Windows & Linux) GDC (MAC & Linux) MacroMates TextMate (MAC) Any Text Editor",
def,C++ Module-Definition File,Microsoft Visual Studio (Windows) Any Text Editor,
dtd,Document Type Definition File,"Altova XMLSpy (Windows, Mac & Linux) Apple TextEdit (Mac) JAPISoft EditiX (Windows) Liquid Technologies Liquid XML Studio (Windows) MacroMates TextMate (Mac) Microsoft Notepad (Windows) Microsoft Visual Studio (Windows) Progress Stylus Studio (Windows) SyncRO Soft oXygen XML Editor (Windows, Mac & Linux) Other Text Editors",
erb,Ruby ERB Script,Apple TextEdit (Mac) Microsoft Notepad (Windows) Panic Coda 2 (Mac) Any Text Editor,
fla,Adobe Flash Animation,Adobe Flash Professional (Windows & Mac),Adobe Systems
fsproj,Visual F# Project File,Microsoft Visual Studio (Windows),Microsoft
fxc,FilePackager Configuration,DIMDATA FilePackager (Windows),DIMDATA
h,C/C++/Objective-C Header File,"BloodshedSoftware Dev-C++ (Windows) Borland C++ Compiler (Windows) Code::Blocks (Windows, Mac & Linux) Eclipse IDE for C Developers (Windows, Mac & Linux) Embarcadero C++ Builder (Windows) GNU Compiler Collection (Mac & Linux) GNU Emacs (Linux) gVim (Windows) MacroMates TextMate (Mac) MacVim (Mac) Microsoft Visual Studio (Windows) Vi (Linux) Any Text Editor",
hpp,C++ Header File,"Apple Xcode (Mac) BloodshedSoftware Dev-C++ (Windows) Code::Blocks (Windows, Mac & Linux) Embarcadero Technologies C++ Builder (Windows) GNU Compiler Collection (Mac & Linux) MacroMates TextMate (Mac) Microsoft Visual Studio (Windows)",
ise,InstallShield Express Project File,Flexera InstallShield (Windows),Flexera Software
iwb,IWBasic Source Code File,IconicWind IWBasic (Windows),IconicWind Software
java,Java Source Code File,"Apple Xcode (Mac) Eclipse IDE for Java Developers (Windows, Mac & Linux) ES-Computing EditPlus (Windows) Google Android Studio (Windows, Mac & Linux) GNU Emacs (Linux) gVim (Windows) javac (Linux) MacoMates TextMate (Mac) MacVim (Mac) Microsoft Notepad (Windows) Oracle Java Virtual Machine (Windows, Mac & Linux) Oracle NetBeans (Windows, Mac & Linux) Vi (Linux) Xinox JCreator (Windows) Any Text Editor",Oracle
kv,Kivy Language File,"Kivy (Windows, Mac & Linux)",Kivy Organization
lua,Lua Source File,Addon Studio for World of Warcraft (Windows) Blizzard World of Warcraft Interface AddOn Kit (Windows & Mac) GNU Compiler Collection (Mac & Linux) GNU Emacs (Linux) Microsoft Notepad (windows) Notepad++ (Windows) Rovio Mobile Angry Birds (Mac) Vim (Linux) Other text editor,
m,Objective-C Implementation File,"Apple compiler (Linux) Apple Xcode (Mac) Bare Bones BBEdit (Mac) GNU Compiler Collection (Mac & Linux) gVim (Windows) jEdit (Windows, Mac & Linux) MacroMates TextMate (Mac) MacVim (Mac) Richardson EditRocket (Windows, Mac & Linux) Stepstone compiler (Linux) Vim (Linux)",Apple
m4,Macro Processor Library,m4 (Linux) MacroMates TextMate (Mac) Any Text Editor,
md,Markdown Documentation File,"Apple TextEdit (Mac) Daring Fireball Markdown (Windows, Mac & Linux) GitHUb (Web) GNU Emacs (Linux) gVim (Windows) MacroMates TextMate (Mac & Linux) MacVim (Mac) Microsoft Notepad (Windows) Microsoft WordPad (Windows) Vim (Linux) any other text editor",John Gruber
nib,Interface Builder User Interface File,Apple Interface Builder (Mac) Apple Xcode (Mac),Apple
o,Compiled Object File,GNU Compiler Collection (Mac & Linux),
owl,OWL Source Code File,"Owl (Windows, Mac & Linux)",
p,PASCAL Program File,Applause MATLAB PASCAL Python pickle,Niklaus Wirth
pas,Pascal Source File,"Bare Bones BBEdit (Mac) Embarcadero Turbo Pascal (Windows) Free Pascal (Windows, Mac & Linux) Notepad++ (Windows) MacroMates TextMate (Mac) RemObjects Oxygene (Windows) Xidicone Zeus (Windows) Any Text Editor",Niklaus Wirth
pb,PureBasic Source File,"Fantaisie Software PureBasic (Windows, Mac & Linux) Any Text Editor",Fantaisie
pbj,Pixel Bender Bytecode File,Adobe Pixel Bender Toolkit (Windows & Mac) Adobe Flash Player (Windows & Mac),Adobe Systems
pbxuser,Xcode Project User Data File,Apple Xcode (Mac),Apple
pika,Pika Software Builder Project File,Pika Software Builder (Windows),Pika Software
pl,Perl Script,"ActiveState ActivePerl (Windows, Mac & Linux) Bare Bones BBEdit (Mac) ES-Computing EditPlus (Windows) IndigoStar PerlEdit (Windows) Late Night Affrus (Mac) MacroMates TextMate (Mac) Microsoft Notepad (Windows) Perl (Windows, Mac & Linux) Strawberry Perl (Windows)",
pwn,Pawn Source Code File,Pawno (Windows) PawnSciTE (Windows) PawnoX (Windows) SA-MP Editor (Windows) SAMPCE (Windows),ITB CompuPhase
py,Python Script,"gedit (Linux) GNU Emacs (Linux) MacroMates TextMate (Mac) Microsoft Notepad (Windows) Notepad++ (Windows) Python Software Foundation Python (Windows, Mac & Linux) Other text editor",Python Software Foundation
pyw,Python GUI Source File,"pythonw (Windows, Mac & Linux)",
qpr,FoxPro Generated Query Program,Microsoft Visual FoxPro,
rc,Resource Script,Borland C++Builder Embarcadero C++ Builder Microsoft Visual Studio,Microsoft
resources,Visual Studio Resource File,Microsoft Visual Studio (Windows),Microsoft
s19,Motorola S19 File Record,Metrowekrs CodeWorrior (Windows & Mac) P&E Microcomputer Systems WinIDE (Windows),Motorola
sb,Scratch Project File,"MIT Scratch (Windows, Mac, Linux & Web) Panther (Windows) Snap! (Windows, Mac & Linux)",MIT
sb2,Scratch 2.0 Project File,"MIT Scratch (Windows, Mac, Linux & Web) Panther (Windows) Snap! (Windows, Mac & Linux)",MIT
sh,Bash Shell Script,"Apple Terminal (Mac) Cygwin (Windows) BNU Bash (Windows, Mac & Linux) gVIM (Windows) iTerm (Mac) MacVim (Mac) Notepad++ (Windows) Vim (Linux)",
sln,Visual Studio Solution File,Microsoft Visual Studio 2013 (Windows) MonoDevelop (Windows & Mac) VSoft Technologies FinalBuilder (Windows),Microsoft
sma,AMX Mod Plugin Source File,AMX Mod (Windows & Linux) AMX Mod X (Windows & Linux),n/A
ss,SilverStripe Source Code File,"Silver Stripe (Windows, Mac & Linux)",SilverStripe
